Date,Time,Source,Link,Text
2026-04-29,09:12,UP,https://www.pravda.com.ua/news/2026/04/29/8032297/,"Російські війська масовано атакували південь Одещини 29 квітня. Унаслідок цього є руйнування лікарні та житлових будинків, виникла пожежа у заповіднику, двоє людей постраждали. Джерело: голова Одеської ОВА Олег Кіпер, ДСНС Пряма  мова: ""На жаль, постраждало двоє людей: 47-річний чоловік та 56-річна жінка. Жінку госпіталізовано з множинними осколковими пораненнями, її стан лікарі оцінюють як важкий. Внаслідок влучання ударного БпЛА пошкоджено районну лікарню. Повністю зруйновано приймальне відділення. Значних пошкоджень зазнали терапевтичне, кардіологічне та хірургічне відділення, а також кабінети УЗД, ренген та інші"". Деталі: За даними ОВА, постраждалих внаслідок атаки на лікарню немає: медичний персонал та пацієнти перебували в укритті. Наразі пацієнти переведені у інше відділення. Також виникла пожежа на території Дунайського біосферного заповідника."
2026-04-29,09:37,UP,https://www.pravda.com.ua/news/2026/04/29/8032301/,"Європейський Союз розглядає можливість посилення умов щодо виплати кредиту Україні на суму 90 млрд євро, при цьому частина виплат залежатиме від запровадження непопулярних змін у оподаткуванні підприємств. Джерело: ""Європейська правда"" з посиланням на Bloomberg Деталі: У центрі обговорення опинилися зміни в пільговому режимі оподаткування, що діє наразі для деяких українських компаній. Спочатку розроблений для індивідуальних підприємців та малих підприємств, він дозволяє компаніям сплачувати мінімальну ставку у розмірі 5% від виручки. Міністерство фінансів та основні донори України стверджують, що ця схема є тягарем для військового бюджету, спотворює конкуренцію та сприяє підтримці великої тіньової економіки. Джерела агентства розповіли, що пропозиція вимагатиме від влади в Києві ввести 20-відсотковий податок на додану вартість для тих компаній, які наразі працюють у рамках пільгової системи і чий річний дохід перевищує 4 млн гривень. Допомога ЄС, на яку потенційно може вплинути нова умова, становить лише невелику частину всього дворічного пакета, який складається з близько 60 млрд євро на підтримку оборони, а решта розподілена між макрофінансовою допомогою та так званим пакетом Ukraine Facility, який надає кошти на загальні бюджетні видатки. Представники Європейської комісії заявили, що комісія ""невтомно працює"" над завершенням меморандуму про взаєморозуміння, який закріпить умови фінансування України, але відмовилися надати подробиці. За словами представника Єврокомісії, виконавчий орган ЄС завжди узгоджує свою ""програму реформ з МВФ, і в цьому випадку це також так"". Мета полягала в тому, щоб завершити переговори ""якнайшвидше, розробивши амбітну програму реформ для зміцнення економіки України"" та прискорити її інтеграцію з ЄС, додав він. Однак ці зусилля, ймовірно, посилять напруженість всередині українського суспільства, оскільки пропоновані заходи вкрай непопулярні. Протистояння між парламентом і президентом Володимиром Зеленським також ускладнює їхню реалізацію. Хоча нові умови не торкнуться ключової оборонної допомоги, їхня реалізація, ймовірно, все одно зіткнеться з труднощами, додає агентство. Також у публікації йдеться, що навіть якщо Україні вдасться виграти час зараз, їй зрештою доведеться реформувати свою податкову систему, щоб увідповіднити її до правил ЄС під час переговорів про вступ. Це включатиме скасування деяких пільг. Наразі міжнародні донори Києва могли б розглянути інші заходи щодо збільшення доходів або стримування тіньової економіки, сказало одне з джерел. Раніше ""Європейській правді"" стало відомо, що перший транш з ""військової"" частини кредиту ЄС на 90 млрд євро становитиме 6 млрд і надійде Україні щонайпізніше в червні. Перший оборонний транш буде спрямований на закупівлю дронів, вироблених в Україні. Графік наступних виплат ""військової"" частини кредиту ще не затверджено, але вони мають відбуватися швидше. За даними ""ЄвроПравди"", у наступний пакет можуть увійти боєприпаси, дрони та засоби протиповітряної оборони. Детальніше читайте: ""Дружба"", зброя та реформи. На яких умовах ЄС дасть Україні 90 млрд євро та куди підуть гроші"
2026-04-29,10:24,UP,https://www.pravda.com.ua/news/2026/04/29/8032305/,"Рух опору ""Жовта стрічка"" залишив у чат-боті ""Разом"" для активістів з тимчасово окупованих територій виключно інструкції з безпеки та пообіцяв повністю переформатувати роботу. Дослівно: ""Звертаємо вашу увагу, що наразі у функціоналі чат-бота залишаються виключно інструкції з безпеки для людей, які перебувають на тимчасово окупованих територіях. Це необхідний крок для забезпечення максимальної захищеності наших громадян. Найближчим часом чат-бот буде повністю переформатовано"". Деталі: Організатори додали, що будь-який спротив в умовах російської окупації – це ризик, а безпека активістів на окупованих територіях залишається для них пріоритетом. Дослівно: ""Але важливо називати речі своїми іменами. Ризик для українців створює не спротив. Ризик створює російська окупація, репресії та терор проти цивільного населення. Українці на окупованих територіях – не є пасивними жертвами. Це люди, які свідомо обирають зберігати свою ідентичність і чинити опір""."
2026-04-29,10:24,UP,https://www.pravda.com.ua/news/2026/04/29/8032304/,"Російська влада заявила про атаку безпілотників на об'єкти в містах Орськ Оренбурзької області та Перм Пермського краю, що більш ніж за 1500-1800 км від кордону з Україною. Пабліки пишуть про пожежу на НПЗ ""Орськнафтооргсинтез"", також під атакою міг бути ""ЛУКОЙЛ-Пермнафтооргсинтез"". Джерело: голова Орська Артем Воробйов, губернатор Пермського краю Дмитро Махонін, Росавіація та Міноборони РФ у Telegram, російський Telegram-канал Astra Деталі: Воробйов повідомив про ""небезпеку атаки БпЛА на території міста"" і закликав мешканців ""не виходити на вулицю і не підходити до вікон"". Росавіація ввела тимчасові обмеження на прийом і випуск повітряних суден в аеропорту Орська та низки інших міст у РФ. За даними Astra, в Орську безпілотники атакували НПЗ ""Орськнафтооргсинтез"" – один із найбільших нафтопереробних заводів Росії. ПАТ ""Орськнафтооргсинтез"" входить у структуру холдингу ""ФортеІнвест"", що належить групі ""Сафмар"" Михайла Гуцерієва, і переробляє близько 6 млн тонн нафти на рік. Підприємство випускає бензин, дизельне паливо, мазут, бітум, авіаційний гас та інші нафтопродукти. Astra зазначає, що цей НПЗ відіграє важливу роль у забезпеченні нафтопродуктами Уралу та Поволжя, крім того, частина продукції йде на експорт. ""Орськнафтооргсинтез"" вже був під атакою у жовтні та листопаді 2025 року. Також про атаку на регіон заявив губернатор Пермського краю Дмитро Махонін. ""Сьогодні на один із промислових майданчиків у Пермському муніципальному окрузі було здійснено приліт ворожого безпілотника. Проведено евакуацію працівників. Постраждалих немає. На об'єкті сталося загоряння. На місці працюють оперативні та екстрені служби"", – написав Махонін. Astra з посиланням на місцевих жителів пише, що величезна кількість машин швидкої та пожежних приїхала в район села Башкултаєво, що за 15 км від Пермі. На лінії між містом Перм і Башкултаєво розташований один із найбільших і високотехнологічних нафтопереробних заводів Росії ""ЛУКОЙЛ-Пермнафтооргсинтез"". За даними російського Міноборони, за ніч засоби ППО нібито перехопили та знищили 98 українських БпЛА над Астраханською, Бєлгородською, Волгоградською, Воронезькою, Курською, Ростовською, Саратовською областями РФ і тимчасово окупованим Кримом."
2026-04-29,10:35,UP,https://www.pravda.com.ua/news/2026/04/29/8032306/,"Працівники Державного бюро розслідувань і Служби безпеки України викрили військовослужбовця, якого підозрюють у передачі представникам держави-агресора важливих даних. Джерело: ДБР, СБУ, спеціалізована прокуратура у сфері оборони Центрального регіону Деталі: За даними слідства, після мобілізації та проходження служби у прикордонному підрозділі він встановив зв'язок із представником спецслужб РФ через месенджер і погодився на співпрацю за гроші. Надалі військовослужбовець передавав інформацію про маршрути руху повітряних суден, а також координати розташування засобів протиповітряної оборони, радіолокаційних станцій і мобільних вогневих груп. Це ставило під загрозу не тільки виконання завдань Силами оборони України, а й життя багатьох українських військових та цивільних, кажуть у ДБР. Під час ""виконання завдань"" він використовував спеціалізоване програмне забезпечення, призначене для операторів радіолокаційних станцій. Це давало змогу отримувати детальну інформацію про повітряну обстановку не тільки у зоні відповідальності свого підрозділу та оперативно передавати її ворогу. Такі дані не перебували у відкритому доступі та могли бути використані агресором для ударів по українських військових і цивільних об'єктах, зазначають у Бюро. Слідчі Бюро задокументували кілька епізодів передачі інформації. У квітні 2026 року військовослужбовця затримали за підозрою в держзраді, суд арештував його без можливості внесення застави, повідомляють у прокуратурі. Йому загрожує покарання у вигляді позбавлення волі на строк п'ятнадцять років або довічне позбавлення волі, з конфіскацією майна."
2026-04-29,11:03,UP,https://www.pravda.com.ua/news/2026/04/29/8032309/,"Прикордонники фіксують збільшення кількості бажаючих незаконно перетнути кордон по річці Дністер. Джерело: речник Держприкордонслужби полковник Андрій Демченко в інтерв'ю ""Укрінформу"" Пряма мова: ""Хочу відмітити, що за останній час збільшилась кількість бажаючих незаконно перетнути кордон по річці Дністер. Часто під час таких спроб використовуються не лише гідрокостюми, а й акваскутери"". Деталі: Офіцер пояснив: акваскутери - це пристрої, які тягнуть людину, допомагають швидше плисти. Тобто, фактично людина, тримаючись за акваскутер, пірнає під воду і в такий спосіб намагається бути менш помітною. На уточнююче запитання, щодо використання річки Тиси на Західній Україніи, речник зауважив, що ""Тису порушники як і раніше намагаються подолати, але Дністер наразі почав користуватись збільшеним ""попитом""."
2026-04-29,11:15,UP,https://www.pravda.com.ua/news/2026/04/29/8032314/,"Президентка Європейської комісії Урсула фон дер Ляєн заявила, що перший оборонний пакет для України з кредиту на суму 90 млрд євро буде виплачений у поточному кварталі - він становитиме біля 6 млрд євро і стосуватиметься українських дронів. Джерело: ""Європейська правда"" Деталі: Виступаючи на пленарному засіданні Європейського парламенту 29 квітня, Урсула фон дер Ляєн підтвердила наміри ЄС виплатити Україні перший 6-мільярдний транш з кредиту 90 млрд євро у 2 кварталі 2026 року. Пряма мова: ""Навесні ми сказали, що надамо кредит на 90 мільярдів для України, так чи інакше. Тепер ми виконали цю обіцянку. Ми виплатимо перший транш у розмірі 45 мільярдів євро за 2026 рік, ще цього кварталу"". Деталі: Вона нагадала, що одна третина від 90 млрд євро кредиту від ЄС піде на бюджетні потреби України, а дві третини – на оборону України. ""Перший оборонний пакет буде стосуватися дронів з України для України, вартістю близько 6 мільярдів євро"", – підтвердила президентка Єврокомісії. Посадовиця запевнила, що Євросоюз ""продовжуватиме підтримку хороброго українського народу та його збройних сил"". ""У той час як Росія подвоює свою агресію, Європа подвоює нашу підтримку України"", – наголосила Урсула фон дер Ляєн. Знати більше: ""Дружба"", зброя та реформи. На яких умовах ЄС дасть Україні 90 млрд євро та куди підуть гроші"
2026-04-29,11:30,UP,https://www.pravda.com.ua/news/2026/04/29/8032315/,"Працівники ДБР спільно з СБУ та Державною прикордонною службою викрили канал втечі військових, які самовільно залишили частини та намагалися виїхати за кордон. Джерело: ДБР, ДПСУ, спеціалізована прокуратура у сфері оборони Східного регіону Деталі: Про підозру повідомили підполковнику – колишньому командиру батальйону однієї з військових частин Національної гвардії України та цивільній особі. За даними слідства, житель Запоріжжя шукав ""клієнтів"" через Інтернет. Свої послуги назвав ""Таксі для військових 24/7 Запоріжжя"". За гроші обіцяв довезти в будь-яке місто України та допомогти безперешкодно проїхати блокпости. До схеми долучився посадовець військової частини. Під час перевірок він виходив на відеозв'язок і пояснював мету поїздки – як нібито законну – ""рекрутингова процедура"". Це дозволяло авто рухатися далі. Також чоловіків інструктували, як діяти під час незаконного перетину кордону. Фігурантів затримали після отримання 4 тисяч доларів за організацію втечі бійця з військової частини у Запоріжжі, що мав рухатись до прикордонної зони в Одеській області. Організатору та його спільнику (підполковнику) повідомили про підозру у закінченому замаху на пособництво дезертирству та сприянні незаконному переправленню осіб через державний кордон (ч. 2 ст. 15, ч. 5 ст. 27, ч. 4 ст. 408, ч. 3 ст. 332 КК України). Їм загрожує до 12 років позбавлення волі. Також прокуратура звітує про обшуки за місцями проживання підозрюваних та в їхніх транспортних засобах. Вилучено грошові кошти у сумі 4900 доларів США, з них наданої неправомірної вигоди 3500 доларів США, банківські картки, мобільні телефони та карти пам'яті, транспортні засоби: BMW 330D, BMW X5. Прокурором подано до суду клопотання про накладення арешту на вилучене майно. За клопотанням прокурора до підозрюваних застосовано запобіжний захід у вигляді тримання під вартою з можливістю внесення застави у розмірі 266 тисяч грн."
