Date,Time,Source,Link,Text
2026-04-29,13:17,UP,https://www.pravda.com.ua/news/2026/04/29/8032330/,"Одна з розмов, задокументованих НАБУ у рамках справи ""Мідас"" у квартирі наразі підсанкційного бізнесмена Тимура Міндіча, якого підозрюють у корупції в сфері енергетики, була з жінкою на ім'я Наталя і стосувалась будівництва маєтків ексвіцепрем'єр-міністра Олексія Чернишова, якого підозрюють у зловживанні службовим становищем та одержанні хабаря, Міндіча та ще двох людей, яких називали ""Андрій"" і ""Вова"". Джерело: ""Українська правда"", яка публікує першу частину так званих ""плівок Міндіча"" Деталі: Розмова, задокументована у квартирі Міндіча за адресою Грушевського, 9а, вранці 1 липня 2025 року. Вона велася російською мовою. Близько 11 ранку Міндіч говорить жінкою, яку він називає ""Наталі"" і яка, ймовірно, керує будівництвом кооперативу ""Династія"" – 4 маєтків у Козині під Києвом, які, за даними джерел УП, зводять для президента Володимира Зеленського, ексглави ОП Андрія Єрмака, ексвіцепрем'єр-міністр Олексія Чернишова та самого Міндіча. Ця розмова може бути першим свідченням того, що дані джерел – правда, адже сторони згадують Чернишова, будівництво Міндіча та будівництво Андрія і Вови. Наталя питає Міндіча, що вони мають робити з забудовою, а той каже, що все треба консервувати і згадує ""Макса Донця"" (ймовірно, мова могла йти про керівника особистої охорони президента Максима Донця – ред.), ""Шуру"" і ""Сігізмунда"" (ймовірно, бізнесмена Олександра Цукермана та ексміністра енергетики Германа Галущенка – ред.), з якими пізніше матиме розмови. Міндіч: ""И сейчас надо это все по уму замораживать. Но по уму, чтоб потом и мой, и этот, и этот соседский. И там надо территорию как-то взять под контроль, потому что там ну этот *** что творит, ну как-то натворил"". Наталя: ""Э смотри, сейчас мы там так разгулялись у тебя, что сейчас заморозить, просто так уйти я не представляю, как. Это все пропадет. Если надо консервироваться, значит надо кончить какие-то работы"". Також Міндіч каже, що треба законсервувати і спільну територію – усе на рік. Наталя каже, що туди ""стільки душі вклала"", і це ""жах"", що тепер треба їхати звідти. Наталя: ""Это для меня ужас"". Міндіч: ""А для меня нет? *** тупой, если он вскроется, в деде нами будет ***"" (ймовірно, може мати на увазі Чернишова, щодо якого розслідують кримінальне проваджання, – ред.) Наталя: ""Там вообще, какие ваши фигурируют в деле?"" Міндіч: ""Не, там все так, прораб, ***"". Наталя: ""Все ушли, и этот ушел, и Стеренжик ушел, короче, ладно, надо…"" Міндіч: ""Надо взять твоего, чтобы он общую базу всю законсервировал. Ворота, вода, свет, вот это все нужно как-то законсервировать. Все поуходили, побросали. Все пропадет, нужно довести как-то это все до ума"". Наталя: ""Дело в том, что у них все коробки с антикварной крышей, с фасадом, не пропадет. Пропадет у тебя, у тебя. Потому что у тебя начаты работы и не закончены. Надо закончить до конца лета, пока тепло"". Далі Наталя розповідає, що наразі роблять басейн, і що вона ""не може залишити цю чашу"". Наталя: ""Я всем должна, это кошмар. Они привезли всю эту технологию, всю плитку. Мне сейчас 90 штук надо отдать. Люди приехали работают, ждут. Фасадщики зашли на утепление фасада, 70 штук сейчас надо дать… Славик плюс уже сделал перегородки тебе, привезли эту лестницу, уже сделали. Основное надо сделать – заштукатурить грязной штукатуркой дом основной. Внутри. Она потом высохнет, потом не сможем заменить. И утеплить фасад, все. И на этом можно будет консервировать"". Міндіч цікавиться, чи за рік це все не зіпсується, Наталя запевняє, що ""нічого не буде"". Міндіч також каже, що хоче посадити дерева. Міндіч: ""Значить нужно пол миллиона, правильно?"" Наталя: ""Ну, надо хотя бы 300. 250 – это Славик, и 90 – на бассейн"". Міндіч: ""250 и 90 – 340, 350, плюс еще на эти, на канал. Я тебе дам не только. А что сегодня долги есть?"". Наталя: ""Они здесь уже включены"" Міндіч: ""Давай я тебе 50 сейчас отдам, сегодня"". Наталя: ""А что мене 50? Что мене даст 50? Мне строителям надо отдать 180, что на стройку, и 70 – это утепление фасада"". Міндіч: ""Скажи, тебе надо 300 тысяч дать? Но у меня нет 300 с собой просто. Давай на понедельник тебе 300 тысяч. 350"". Наталя: ""Ну давай 50 отдам Славику завтра, чтоб он просто не стоял"". Міндіч: ""Ану покажи мне, как там внутри. А чей это дом? Это ж не мой"". Наталя: ""Это Андрея. Я ж тоже ему делаю"". (Ймовірно, мова може йти про будинок у кооперативі ""Династія"", який Міндіч з Чернишовим будували для ексглави ОП Андрія Єрмака, – ред.). Далі вони обговорюють два будинки – ""перший"" і ""четвертий"", – де все вже зробили, ""з інженерією всередині, вентиляторами, кондиціонерами, теплою підлогою"". Наталя: ""У Андрея только фасады, внутри просто. А у тебя даже этого нет"". Міндіч: ""Я не могу сейчас строить, потому что кипишь из-за єтого ***. Ну, а он знает, что он пид***с?"" Наталя: ""Я тебе тогда еще говорила, что он пид***ас, когда ты меня туда только послал. Я тебе сказала, что у нас не хватает, блин, я ж вижу, что он творит, даже тут, даже тут, что творит. Теперь тот бегает, плачет. Скажи, что делать с электричеством? Он же, зараза, поотключал. Если до 5-го числа не проплатим, он отключит (ймовірно, мова йде про Чернишова, який своїми проблемами з НАЬУ і САП підставив близьких, які будувати 4 маєтки, – ред.) Далі Міндіч каже про те, що треба все обгородити парканом, ""пса завести"", охорону постійно тримати, щоб ""ніхто не проліз, журналісти-шмурналісти"" (ймовірно, говорить про журналістів ""Бігус.Інфо"", які пізніше опублікували матеріал про кооператив ""Династія"", – ред.) Наталя каже, що на електрику на 4 ділянки ""в місяць треба 120 тисяч"". Міндіч: ""Это все в бюджет 400 тысяч до холодов? 400 тысяч до холодов тебе надо дать?"". Наталя: ""Нет, если с сетями, то это 1 миллион 300"". Міндіч: ""Миллион триста гривен или долларов?"" Далі вони обговорюють, якийсь камінь для фасаду, який постачав єдиний постачальник Сиранчук, і що Наталя з тих кошторисів ""скосила 100 тисяч"". Наталя: ""100 штук он хотел тут заработать на твоем камне. Представляешь, как он зарабатывал на тех домах? Так ты думаешь, что с Чернышова он так скосил? Я видела эти сметы – он так за 7 домов поднял эти деньги"". Міндіч: ""Я думаю, Чернышеву строил за счет нас"". Далі вони обговорюють кам'яні і бетонні роботи. Наталя: ""Он же бросил между тобой и Вовой, уже забетонировал забор. Осталось забор поставить. Тоже тянул, тянул, оставалось 10 м, тоже бросили все, ушли. А почему ушли? Потому что он 2 месяца не платил зарплату людям. Просто 2 месяца. Крышникам тоже 50 штук долг. Они собрались и ушли. Он же всем должен"". Далі обговорюють, які дерева засадити на першій лінії від Дніпра, які дерева будуть ""у Вови"" і які дерева будуть ""між Тимуром і Вовою"" та інше. Також Міндіч каже, що треба закінчити будівництво, але на когось переоформити, може, на неї – Наталю. У липні 2025 року ці маєтки знайшли журналісти ""Бігус.Інфо"". Далі НАБУ і САП відкрили кримінальну справу. А минулої осені ці маєтки, ще до їх консервації, арештували. Читайте також: Були ""слуги"" – стали ""династія"". Як віцепрем'єр Чернишов під час війни будував котеджне містечко"
2026-04-29,13:18,UP,https://www.pravda.com.ua/news/2026/04/29/8032334/,"Прессекретар правителя Росії Дмитро Пєсков заявив, що парад до 9 травня у Москві пройде у ""скороченому форматі"" через терористичну загрозу і ще тому, що дата не ювілейна. У Санкт-Петербурзі парад також пройде без техніки. Джерело: коментар Пєскова російським ЗМІ передає ""Медуза"", ""Фонтанка"" Деталі: Речник заявив, що причина ""скорочення"" параду – ""оперативна ситуація"". Пряма мова: ""Київський режим, (так росіяни називають українську владу, – ред.) який щодня втрачає землі на полі бою, зараз повністю розгорнув терористичну активність. І тому на тлі цієї терористичної загрози, звісно ж, вживаються всі заходи для мінімізації небезпеки"". Деталі: Він пояснює, що нібито минулоріч минулого року ""ювілейний парад"" був широкоформатний, а цього року дата не ювілейна, тому подія буде у ""скороченому форматі"". Окрім того, видання ""Фонтанка"" повідомило, що на Двірцевій площі в Санкт-Петербурзі парад теж пройде без техніки і без участі курсантів. А кількість глядачів параду скоротять приблизно у 18 разів. Замість спочатку запланованих 5,6 тисячі гостей буде лише одна трибуна на приблизно 300 місць. Рішення ухвалили після наради з питань безпеки. 28 квітня російське Міноборони заявило, що парад 9 травня в Москві пройде без військової техніки та участі курсантів військових училищ через ""поточну ситуацію""."
2026-04-29,13:35,UP,https://www.pravda.com.ua/news/2026/04/29/8032336/,"Радник президента України Дмитро Литвин відреагував на пропозицію майбутнього прем'єра Угорщини Петера Мадяра зустрітися з Володимиром Зеленським: каже, що український президент ще не склав графік зустрічей. Джерело: Литвин у коментарі журналістам в середу, повідомляє ""Європейська правда"" Деталі: Литвин зауважив, що ""президент ще не узгоджував графік на червень"". Також він додав, що ""двосторонні зустрічі узгоджуються у двосторонніх контактах"". Напередодні Петер Мадяр прийняв у себе мера українського міста Берегове на Закарпатті та обговорив з ним ситуацію угорської меншини. Мадяр повідомив, що ініціює зустріч з президентом України Володимиром Зеленським на початку червня у Берегові. ""Настав час для України завершити понад десятиліття законодавчих обмежень, а для угорців Закарпаття – відновити усі їхні культурні, мовні, адміністративні й освітні права та стати знову рівноправними й шанованими громадянами України"", – заявив Мадяр. Мер міста Берегове Золтан Баб'як на зустрічі з Мадяром заявив, що в Україні немає жодних утисків угорської національної спільноти. Як відомо, Мадяр одразу після перемоги опозиційної ""Тиси"" на виборах заявив, що для налагодження добросусідських відносин з Україною питання нацменшин потребуватиме врегулювання."
2026-04-29,13:39,UP,https://www.pravda.com.ua/news/2026/04/29/8032337/,"Російські окупанти вдарили безпілотником по автобусу приватного перевізника в Херсоні вранці 29 квітня. Джерело: начальник Херсонської міської військової адміністрації Ярослав Шанько у соцмережах Деталі: Приблизно о 10.30 середи у Дніпровському районі міста російські терористи вкотре здійснили атаку на громадський транспорт. Повідомляється, що цього разу під удар ворожого безпілотника потрапив автобус приватного перевізника. За словами власника, транспорт відновленню не підлягає. Пряма мова Шанька: ""На щастя, ні водій, ні пасажири не травмувались. Тілесні ушкодження дістав херсонець похилого віку, який перебував на вулиці. Потерпілого ушпиталили""."
2026-04-29,14:03,UP,https://www.pravda.com.ua/news/2026/04/29/8032342/,"В останній день квітня подекуди пройдуть невеликі дощі, а перші дні травня будуть прохолодними, вночі в у низці областей ще очікують невеликий мінус. Дослівно УГМЦ: ""30 квітня – 1 травня вночі без опадів, вдень 30 квітня в більшості областей, 1 травня на Лівобережжі місцями невеликий дощ; 2 травня в Україні переважно без опадів"". Деталі: 30 квітня – 2 травня вночі в Україні подекуди очікуються заморозки 0-3° (у південній частині вночі 1-6° тепла), вдень 8-13° тепла, на заході країни до 18°, на півдні до 16° тепла. Вітер в країні переважно північно-західний, 5-10 м/с. У Києві 30 квітня вночі без опадів, 1-3° тепла, вдень до невеликий дощ, до +12°, вітер північно-західний, 5-10 м/с. 1 та 2 травня у столиці без опалів, вночі 1-3° тепла, вдень до +14°, вітер змінних напрямків, 3-8 м/с."
2026-04-29,14:04,UP,https://www.pravda.com.ua/news/2026/04/29/8032343/,"Державний прикордонний комітет Білорусі повідомляє, що громадяни Росії, яким заборонили виїзд із країни через отримання повістки до армії, не зможуть виїхати за кордон через білоруську територію. Деталі: Прикордонники повідомили, що Білорусь і Росія мають спільну базу даних призовників. Дослівно: ""Якщо виїзд заборонено, то всі питання до Російської Федерації"". Більше деталей: На початку тижня російська правозахисна ініціатива ""Рух свідомих відмовників"" повідомила, що з білоруської території не випустили призовника з Санкт-Петербурга, якому заборонили залишати Росію. 23 квітня в аеропорту Мінська його не пустили на рейс до Тбілісі, а 25 квітня йому відмовили у виїзді за внутрішнім паспортом до Єревану. У всіх випадках жодних письмових підтверджень не видали, зазначили правозахисники. За даними ініціативи, цей випадок свідчить про те, що Білорусь та Росія почали обмінюватися даними з електронного реєстру військового обліку та реєстру повісток."
2026-04-29,14:19,UP,https://www.pravda.com.ua/news/2026/04/29/8032348/,"Україна офіційно звернулася до Ізраїлю дипломатичними та юридичними каналами з проханням вжити заходів щодо судна ""Панорамітис"". Джерело: очільник МЗС Андрій Сибіга та генеральний прокурор Руслан Кравченко у соцмережах Деталі: Офіс генерального прокурора ініціював арешт морського судна PANORMITIS / ""Панорамітис"" та вантажу, який, за даними слідства, може бути частиною схеми з легалізації незаконно вивезеного українського зерна. Відповідний запит про міжнародну правову допомогу вже скеровано до компетентних органів Держави Ізраїль, зазначає Кравченко. Українська сторона просить ізраїльських партнерів накласти арешт на судно та вантаж, провести обшук, вилучити суднову й вантажну документацію, відібрати зразки зерна та допитати членів екіпажу. За даними слідства, PANORMITIS перевозить зерно, частково вивезене з тимчасово окупованих територій України. Продукцію завантажили після перевалки з іншого судна. Наразі воно прямує до порту Хайфа. Слідчі задокументували факти незаконного заходу судна в закриті порти України. Це грубе порушення українського законодавства та норм міжнародного морського права. Досудове розслідування цієї справи здійснює Головне слідче управління СБУ за процесуального керівництва прокурорів ОГП. Пряма мова Сибіги: ""Це не Твіттер-дипломатія, а цілком конкретний юридичний та дипломатичний запит на міжнародну правову допомогу, який вимагає відповіді. Ми очікуємо, що ізраїльська сторона поставиться до нього серйозно, а не відповідатиме емоційними заявами"". Довідково: За даними ОГП, від початку повномасштабної агресії РФ з тимчасово окупованих територій України незаконно вивезено понад 1,7 млн тонн агропродукції загальною вартістю понад 20 млрд грн."
