Date,Time,Source,Link,Text
2026-04-30,10:44,UP,https://www.pravda.com.ua/news/2026/04/30/8032478/,"Поліція повідомила, що з Естонії екстрадували організатора схеми продажу неіснуючих авто для ЗСУ – зловмисники представлялись волонтерами/представниками відомих благодійних фондів, брали передоплату за купівлю чи доставку авто і зникали, завдаючи щомісячних збитків військовим на понад 5 млн грн. Джерело: Національна поліція Деталі: Зазначається, що з початку повномасштабного вторгнення учасники злочинної організації масово розміщували в інтернеті оголошення про продаж і доставку автомобілів із Європи за заниженими цінами. ""Вони діяли на різних платформах, використовували вигадані анкетні дані та представлялися митними брокерами, водіями автовозів, волонтерами та співробітниками благодійних фондів - найчастіше фондом Сергія Притули"", – йдеться в повідомленні. За даними поліції, зловмисники брали передплату у військових за доставку авто і просили їх відразу записати відеоподяку нібито ""для звітності"", але машину не привозили, гроші не віддавали, а відео використовували для обману інших людей. Організатором схеми виявився громадянин України, якого раніше вже притягували до відповідальності за кордоном і якому повідомляли про підозру в Україні за шахрайство. Зловмисник перебував в Естонії. Там його затримали та в межах процедури екстрадиції передали Україні. Суд уже обрав фігуранту запобіжний захід у вигляді тримання під вартою без права внесення застави. Наразі триває документування інших учасників злочинної організації, які перебувають за кордоном. Поліція закликає людей, які постраждали від цієї шахрайської схеми або мають важливу для слідства інформацію, повідомити про це у поліцію. ""Кожне звернення має значення. Гаряча лінія: +380 95 681 17 13"", – заявили в поліції."
2026-04-30,10:48,UP,https://www.pravda.com.ua/news/2026/04/30/8032480/,"Президент Володимир Зеленський доручив з'ясувати деталі пропозиції правителя РФ Володимира Путіна оголосити перемир'я на 9 травня, а також запропонував у відповідь припинити вогонь довгостроково. Джерело: Зеленський у соцмережах Пряма мова: ""Доручив нашим представникам зв'язатись із командою Президента Сполучених Штатів і з'ясувати деталі російської пропозиції про короткострокову тишу"". Деталі: За його словами, Україна прагне миру й забезпечує необхідну дипломатичну роботу для реального закінчення цієї війни. З'ясуємо, про що конкретно йдеться: про кілька годин безпеки для параду в Москві чи про щось більше. ""Наша пропозиція – припинити вогонь довгостроково, гарантувати надійну безпеку для людей і довготривалий мир. Україна готова працювати заради цього в будь-якому достойному та ефективному форматі"", - зазначив президент."
2026-04-30,10:58,UP,https://www.pravda.com.ua/news/2026/04/30/8032479/,"Заступник командувача Повітряних сил ЗСУ полковник Павло Єлізаров розповів, що наразі Україна ліквідовує приблизно 35 тисяч окупантів щомісяця, але якщо росіяни наростять темпи залучення до армії, то втрат окупантів буде більше. Джерело: Єлізаров в інтерв'ю ""Українській правді"" На питання, чи наблизилась Україна до знешкодження 50 тисяч росіян щомісяця, Єлізаров відповів: ""У них не вистачає людей. Ми могли б робити більше за планом. Але, знаєте, збирати яблука в саду, де їх уже немає – складно"". Деталі: Полковник уточнив, що у росіян наразі існує проблема нестачі людей і їм потрібно ""трохи наростити темпи"". Наразі, за його словами, Україна ліквідовує приблизно 35 тисяч окупантів щомісяця: ""Якщо вони збільшать потік, зросте й кількість втрат. Якщо рухатимуться повільно – це буде на рівні 30–35 тисяч"". Глава Міноборони Михайло Федоров після призначення говорив, що Україні потрібно знищувати 50 тисяч росіян щомісяця на фронті."
2026-04-29,00:22,UP,https://www.pravda.com.ua/news/2026/04/29/8032268/,"У виступі перед Конгресом США король Великої Британії Чарльз III наголосив на необхідності ""рішучої підтримки"" України на тлі глобальної нестабільності. Джерело: король Великої Британії Чарльз III у виступі перед Конгресом США, цитує ""Суспільне"" Деталі: За його словами, світ переживає часи великої невизначеності — від Європи до Близького Сходу. Монарх вважає, що це створює серйозні виклики для міжнародної спільноти та безпосередньо впливає на життя громадян у різних країнах. У своїй промові британський король окремо відзначив, що для захисту України та її ""найсміливіших людей"" необхідна ""непохитна рішучість"". На його переконання, це дозволить досягти ""справедливого і тривалого миру"". Чарльз III приділив увагу й трансатлантичному партнерству. За його словами, союз між Великою Британією та США, що формувався століттями, є ""унікальним"", і за це британці глибоко вдячні американському народові. Монарх нагадав, що це партнерство є частиною ширшої концепції Атлантичного союзу, яку Генрі Кіссінджер описував як ""піднесене бачення"" 35-го президента Джона Кеннеді. Йдеться про співпрацю, що базується на двох стовпах: Європі та Америці. Він вважає, що наразі таке партнерство ""є важливішим, ніж будь-коли"". Також король заявив, що оновлення безпеки починається із посилення оборони, і, за його словами, Лондон, визнає, що сучасні загрози вимагають трансформації Збройних сил. Крім того, Чарльз III наголосив на ключовій ролі НАТО у цьому. Саме тому Британія оголосила про найбільше стабільне збільшення оборонних витрат з часів ""холодної війни"". У цьому контексті він згадав і про власний досвід служби у Королівському флоті понад пів століття тому, підкресливши тяглість військових традицій у королівській родині — від його батька принца Філіпа, герцога Единбурзького, до попередніх поколінь. Чарльз III згадав і про нещодавню спробу замаху на президента США Дональда Трампа та американське керівництво, зазначивши, що ""подібні акти насильства не матимуть успіху"". На завершення промови британський король підкреслив, що ""єдність союзників є визначальною для ефективного протистояння спільним загрозам і збереження міжнародної стабільності""."
2026-04-29,00:54,UP,https://www.pravda.com.ua/news/2026/04/29/8032270/,"У вівторок ввечері та в ніч на середу російська окупаційна армія завдала ударів по Харкову, внаслідок чого постраждала людина, виникла пожежа на парковці гіпермаркету, є ушкоджені будинки. Джерело: міський голова Харкова Ігор Терехов, голова Харківської ОВА Олег Синєгубов Деталі: У Немишлянському, Основ'янському та Слобідському районах були зафіксовані прильоти ворожих дронів. Синєгубов зазначив, що внаслідок ворожого удару в Основ'янському районі спалахнула пожежа на парковці гіпермаркету. За даними Терехова, внаслідок влучання у Немишлянському районі постраждала людина. У цьому ж районі внаслідок влучання ворожого дрона у дерево пошкоджено близько 10 приватних будинків. У Слобідському районі в багатоквартирних будинках, що розташовані поряд з місцем прильоту, вибиті вікна. Пізніше Терехов повідомив про ще один приліт – в Індустріальному районі."
2026-04-29,01:36,UP,https://www.pravda.com.ua/news/2026/04/29/8032271/,"За даними ""Суспільного"", Державний департамент США підтвердив, що тимчасова повірена у справах США в Україні Джулі Девіс залишить посаду, проте заперечив її відставку через розбіжності з американським президентом Дональдом Трампом. Джерело: ""Суспільне"" із посиланням на речника Держдепу Томмі Піготта Деталі: Як зазначає ""Суспільне"", у Державному департаменті США заперечили, що Девіс іде у відставку через розбіжності з Трампом. Речник відомства Піготт заявив, що дипломатка була послідовною прихильницею зусиль адміністрації Трампа щодо досягнення миру між Росією та Україною та йде у відставку після 30-річної кар'єри кадрового співробітника дипломатичної служби. За його словами, Девіс залишить Київ у червні 2026 року. Що передувало: Видання Financial Times повідомило, що тимчасова повірена у справах США в Україні Джулі Девіс залишить посаду, тому що розчарована зменшенням підтримки України з боку Дональда Трампа. Попередня пані посол США в Україні Бріджит Брінк у квітні 2025 року повідомила про відставку. За даними ЗМІ, вона вирішила залишити посаду на тлі посилення розбіжностей з адміністрацією президента Дональда Трампа. Згодом тимчасовою повіреною у справах США в Україні стала Джулі Девіс, яка до цього була американським послом на Кіпрі."
2026-04-29,01:58,UP,https://www.pravda.com.ua/news/2026/04/29/8032272/,"Офіційний акаунт Білого дому в мережі X опублікував фото зустрічі президента США Дональда Трампа і короля Британії Чарльза III, що відбулася у вівторок у Вашингтоні, підписавши його ""Два королі"". Джерело: Білий дім у мережі Х Деталі: Це не перший випадок, коли образ Трампа асоціюють з монархом. У жовтні минулого року віцепрезидент США Джей Ді Венс на тлі масштабних протестів проти курсу чинної влади опублікував згенероване відео з Дональдом Трампом в образі короля. Нагадаємо: У березні Сполучені Штати охопили масові протести проти політики президента Дональда Трампа в межах акцій ""Ніяких королів"" (No Kings), в усіх 50 штатах заплановані понад 3 200 заходів. Рух ""Ніяких королів"", започаткований минулого року ⁠у день народження Трампа, 14 червня, зібрав, за оцінками, від 4 до 6 мільйонів людей у близько 2 100 місцях по всій країні. До того люди виходили на вулиці, щоб висловити протест проти чинної адміністрації, навесні минулого року. У другій хвилі акцій, що відбулася в жовтні, взяли участь приблизно 7 мільйонів учасників у понад 2 700 американських містах."
2026-04-29,03:10,UP,https://www.pravda.com.ua/news/2026/04/29/8032274/,"Як повідомляє агентство Reuters, американські спецслужби вивчають, як відреагує Іран у разі проголошення президентом США Дональдом Трампом перемоги у війні з Іраном, яка триває вже два місяці. Джерело: Reuters із посиланням на джерела Деталі: Як зазначає видання, американські спецслужби аналізують це питання на прохання високопоставлених чиновників адміністрації Трампа, аби зрозуміти, як війна проти Ірану може позначитися для республіканців на проміжних виборах у США. Остаточне рішення про закінчення війни поки що не ухвалене, пише Reuters; Трамп може знову активізувати військові операції, але швидке зниження напруженості могло би послабити політичний тиск на лідера США. Раніше розвідувальне співтовариство вже аналізувало ймовірну реакцію іранського керівництва на оголошення США про перемогу, – додають у публікації. У дні після початку кампанії бомбардувань у лютому, розвідувальні агентства дійшли висновку, що якщо Трамп оголосить про перемогу, і США виведуть свої війська з регіону, Іран, ймовірно, сприйме це як свою перемогу, – зазначило одне з джерел видання. Разом з тим додало: якби Трамп натомість заявив, що США перемогли, але зберегли значну військову присутність, Іран, ймовірно, сприйняв би це як переговорну тактику, яка, однак, не обов'язково призвела б до закінчення війни. Reuters пише, що директорка відділу зав'язків з громадськістю ЦРУ після цієї публікації зазначила, що Управління ""не знайоме з оцінкою розвідувального співтовариства, про яку повідомляється"". Видання зазначає, що ЦРУ та інші спецслужби відмовилося відповідати на конкретні запитання щодо своєї поточної роботи щодо Ірану. У Білому домі заявили що США все ще ведуть переговори з іранцями і ""не поспішатимуть укладати невигідну угоду"". ""Президент укладе лише таку угоду, яка ставить національну безпеку США на перше місце, і він чітко дав зрозуміти, що Іран ніколи не зможе володіти ядерною зброєю"", — кажуть у Трампа. Троє осіб, обізнаних з обговореннями в Білому домі останніми днями, описали Reuters Трампа як людину, яка чітко усвідомлює політичну ціну, яку платять він і його партія. Через двадцять днів після того, як Трамп оголосив про припинення вогню, бурхливі дипломатичні зусилля не змогли повністю відкрити економічно важливу Ормузьку протоку, яку Тегеран закрив, атакуючи кораблі та встановлюючи міни у протоці. Дослівно з публікації: ""Блокування судноплавства, яке перевозить близько 20% світової нафти, призвело до зростання цін на енергоносії у всьому світі та цін на бензин у США. Здатність Ірану порушувати торговельні потоки надає йому потужний важіль впливу на Сполучені Штати та їхніх союзників. Рішення про скорочення військової присутності США в регіоні в поєднанні зі взаємним скасуванням блокади зрештою призвело б до зниження цін на бензин. Однак поки що сторони, здається, далекі від будь-якої домовленості"". Деталі: За словами іншого джерела Reuters, обізнаного з внутрішніми рішеннями адміністрації Трампа, на столі офіційно залишаються різні військові варіанти, серед яких — поновлення повітряних ударів по військових і політичних лідерах Ірану. Однак один із американських чиновників та інша особа, обізнана з ходом обговорень, зазначили, що найамбітніші з цих варіантів — такі як наземне вторгнення на територію Ірану — видаються менш імовірними, ніж кілька тижнів тому. Представник Білого дому назвав внутрішній тиск на Трампа з метою завершення війни ""величезним"". Одне з джерел Reuters повідомило, що Іран скористався триваючим перемир'ям, щоб підготувати пускові установки, боєприпаси, дрони та інше спорядження, яке було заховане через бомбардування США та Ізраїлю у перші тижні конфлікту. У підсумку видання зазначає: як наслідок, тактичні витрати на відновлення повномасштабної війни зараз, ймовірно, вищі, ніж були у перші дні перемир'я, яке розпочалося 8 квітня. Що передувало: У вівторок Трамп заявив, що Іран хоче, аби США ""якнайшвидше"" відкрили Ормузьку протоку. Також повідомлялося, що Іран дав зрозуміти, що, можливо, готовий погодитися на проміжну угоду щодо відкриття Ормузької протоки в обмін на припинення Вашингтоном блокади іранських портів, відклавши при цьому складніші переговори щодо ядерної програми. ЗМІ писали, що Трамп дав зрозуміти, що навряд чи прийме останню пропозицію Ірану щодо припинення війни. Державний секретар США Марко Рубіо заявив, що нова пропозиція Ірану ""краща, ніж ми очікували"", але наголосив, що майбутня угода має унеможливити отримання Іраном ядерної зброї."
