Date,Time,Source,Link,Text
2026-04-30,00:41,UP,https://www.pravda.com.ua/news/2026/04/30/8032439/,"Президент Володимир Зеленський заявив, що зміщення фокусу Сполучених Штатів на Близький Схід зменшило тиск на Росію та створює ризик затягування війни, оскільки Москва не погодиться на припинення агресії без більш жорстких та рішучих дій з боку Вашингтона. Джерело: інтерв'ю Зеленського виданню Newsmax Пряма мова: ""Ми всі хочемо зупинити цю війну. Проблема в тому, що пріоритет для Сполучених Штатів зараз змістився на Близький Схід. Я боюся, що якщо ми обмежимося лише розмовами, Росія не відчує найголовнішого, що може дати нам Америка – тиску на неї. Сполучені Штати могли б посилити тиск за допомогою санкцій, але зараз вони їх знімають через Близький Схід, і ми це відчуваємо"". Деталі: За словами президента, пори те, що військова підтримка продовжує надходити, дипломатичний тиск на Кремль став слабшим. ""Я не кажу про їхні пакети озброєнь. Вони продовжують надходити, і ми вдячні за це, за те, що можемо використовувати європейські кошти для закупівлі деяких протибалістичних ракет"", – сказав він. Зеленський додав, що Україна підтримує щоденні контакти з американськими посадовцями, однак наголосив, що самої лише зброї недостатньо без тривалого економічного та політичного тиску. Глава держави також заявив, що Україна не погодилася на прохання партнерів припинити удари по російській енергетичній інфраструктурі. Пряма мова: ""Ми отримували від партнерів повідомлення, що через цей виклик на Близькому Сході, можливо, не варто атакувати певну інфраструктуру, енергетичну інфраструктуру в Росії. І, звісно, я сказав ""ні"", ми будемо відповідати... Ніхто не пропонував нам енергетичного перемир'я. Ми відкриті до цього, але якщо Росія нас атакуватиме, ми відповімо за будь-яких обставин"". Деталі: Зеленський також розкритикував коментарі віцепрезидента Джей Ді Венса, який виступає проти продовження допомоги США Україні, заявивши, що подібна позиція грає на користь Росії. Пряма мова: ""Ми відкриті, і ми не вороги. Ворог – це Росія. Якщо Венс пишається тим, що не допомагає нам, це означає, що він допомагає росіянам. Росія не поважає слабкість, і якщо ніхто нам не допомагатиме, ми, звісно, опинимося в слабшій позиції""."
2026-04-30,00:55,UP,https://www.pravda.com.ua/news/2026/04/30/8032440/,"У ніч на 30 квітня російські війська атакували Одесу ударними безпілотниками. Унаслідок обстрілу постраждали житловий сектор і цивільна інфраструктура, попередньо відомо про шістьох поранених. Джерело: начальник Одеської МВА Сергій Лисак, ""Думська"" Деталі: За словами очільника ОВА, під ворожим ударом опинилися інфраструктура та житловий сектор міста. Зокрема, зафіксовано пошкодження п'ятиповерхового житлового будинку та приватного домоволодіння. Також окупанти поцілили в адміністративну будівлю, заклад освіти та територію автостоянки. ""Попередньо постраждало четверо людей"", – повідомив Лисак. За даними ЗМІ, постраждали дві жінки віком 25 і 44 роки та двоє чоловіків віком 38 і 62 роки, їм надають медичну допомогу. Оновлено: О 02:00 Лисак повідомив про збільшення кількості постраждалих до шести."
2026-04-30,01:34,UP,https://www.pravda.com.ua/news/2026/04/30/8032441/,"Президент США Дональд Трамп заявив, що його адміністрація розглядає можливість скорочення чисельності американського військового контингенту в Німеччині, додавши, що рішення буде ухвалено найближчим часом. Джерело: допис Трампа у власній соцмережі Truth Social, Reuters Пряма мова: ""Сполучені Штати вивчають і розглядають можливість скорочення військ у Німеччині. Відповідне рішення буде ухвалено найближчим часом"". Деталі: Заява Трампа з'явилася на тлі його публічного конфлікту з канцлером Німеччини Фрідріхом Мерцом. У понеділок, 27 квітня, Мерц розкритикував відсутність у Вашингтона чіткої стратегії у діях проти Ірану, тоді як іранське керівництво ""принижує"" американську націю під час переговорів. У відповідь Трамп накинувся на Мерца з різкою критикою. Він звинуватив його в тому, що той ""не має уявлення, про що говорить"" і нібито толерує отримання Іраном ядерної зброї. Адміністрація Трампа також неодноразово висловлювала різку критику на адресу багатьох членів НАТО за те, що вони не допомагають у війні США та Ізраїлю проти Ірану, зокрема дорікаючи деяким за те, що вони не відправили свої військово-морські сили для допомоги. Згідно з даними Центру інформації про військовослужбовців Міністерства оборони США (DMDC), станом на грудень 2025 року на закордонних базах США в Європі перебувало трохи більш як 68 тисяч військовослужбовців на постійній службі. Більше половини з них – близько 36 400 – дислоковані в Німеччині."
2026-04-30,02:35,UP,https://www.pravda.com.ua/news/2026/04/30/8032444/,"У Києві та низці областей України в ніч на 30 квітня оголосили повітряну тривогу через загрозу російських ударних безпілотників. Джерело: Повітряні сили ЗСУ, мапа тривог Деталі: Військові зафіксували активність ворожих ударних дронів, через що у регіонах почали лунати сирени. Небезпека поширилася на столицю та інші області відповідно до курсу руху безпілотників. Громадян закликають
 прямувати до укриттів та перебувати там до завершення повітряної тривоги. Оновлено: О 03:22 в Києві оголосили відбій повітряної тривоги."
2026-04-30,04:00,UP,https://www.pravda.com.ua/news/2026/04/30/8032446/,"Президент Аргентини Хав'єр Мілей публічно підтримав голову уряду Мануеля Адорні, який опинився в центрі корупційного скандалу через підозри у незаконному збагаченні. Деталі: Повідомляється, що Адорні перебуває під слідством через розкішні подорожі та придбання нерухомості, які не відповідають його зарплаті державного службовця. У середу Мілей прибув на виступ Адорні перед законодавцями разом з усіма міністрами на знак солідарності. Президент усміхався, показував великий палець догори та вигукував образи на адресу опозиції. ""Багато хто з вас хотів би перетворити цей виступ на публічне судилище"", – сказав Адорні під час своєї вступної промови, додавши, що не вчиняв жодних злочинів і має намір довести це в суді. ""Щодо питання про те, чи піду я у відставку, чи продовжу працювати на посаді голови кабінету міністрів, хочу чітко всім заявити. Я тут, і я не ховаю свого обличчя"", – заявив голова уряду. Розслідування щодо посадовця розпочалося в березні після публікації фото його дружини, яка летіла до Нью-Йорка президентським літаком. Пізніше з'явилося відео, де родина Адорні подорожує приватним літаком на елітний курорт Пунта-дель-Есте в Уругваї. Аргентинські ЗМІ також повідомляли, що після вступу на посаду він придбав будинок у закритому котеджному містечку та квартиру. Окрім цього, посадовець здійснив оплачені готівкою поїздки на Арубу та до Ріо-де-Жанейро. Адорні відкидає звинувачення і стверджує, що оплачував усі витрати власними коштами. Однак до кінця минулого року його зарплата становила 2500 доларів на місяць, а задекларовані заощадження не перевищували 42 тисяч доларів. Розслідування щодо Адорні розгортається у найскладніший момент президентства Мілея. У квітні його рейтинг схвалення знизився до 35,5%, що майже на 10 відсоткових пунктів менше, ніж на початку року, згідно з опитуванням LatAm Pulse, проведеним компанією AtlasIntel на замовлення Bloomberg News. Під час опитування аргентинці назвали корупцію проблемою, яка турбує їх найбільше, причому трохи більше половини респондентів зазначили, що очікують нових викриттів у найближчі шість місяців."
2026-04-30,04:44,UP,https://www.pravda.com.ua/news/2026/04/30/8032447/,"Очільник Королівського військово-морського флоту Великої Британії генерал Гвін Дженкінс оголосив про створення об'єднаних військово-морських сил з дев'ятьма європейськими країнами для стримування майбутніх російських загроз з боку ""відкритого морського кордону"" на півночі. Деталі: У своїй промові Дженкінс зазначив, що 10 країн-членів Об'єднаних експедиційних сил (JEF) підписали заяву про наміри створити ""багатонаціональні морські сили"", які діятимуть як ""доповнення до НАТО"". До складу альянсу увійдуть Велика Британія, Нідерланди, усі п'ять країн Північної Європи (Данія, Фінляндія, Ісландія, Норвегія, Швеція) та три країни Балтії (Латвія, Литва, Естонія). Канада також розглядає можливість приєднатися. Дженкінс зазначив, що попри кризу, яка триває на Близькому Сході, де Ормузька протока залишається закритою через американо-ізраїльську війну проти Ірану, ""Росія залишається найсерйознішою загрозою для нашої безпеки"". ""За останні два роки кількість російських вторгнень у наші води зросла майже на третину"", – сказав командувач британського флоту, додавши, що, на його думку, Велика Британія має ""відкритий морський кордон із Росією на півночі"". Новими військово-морськими силами ""за необхідності командуватимуть"" із британського військового штабу в Нортвуді (на північному заході Лондона). Вони будуть ""створені для негайного вступу в бій у разі потреби, маючи реальні можливості, реальні військові плани та реальну інтеграцію"", – зазначив Дженкінс. Водночас джерела видання у військово-морських силах зазначають, що британський флот відчуває кризу з наявністю кораблів через брак попередніх інвестицій. Для підвищення боєздатності Дженкінс анонсував, що ""безекіпажні кораблі супроводу"" – великі морські дрони – ходитимуть поруч із британськими військовими кораблями у найближчі два роки. Довідково: Об'єднані експедиційні сили (Joint Expeditionary Force, JEF) – це військово-політична коаліція на чолі з Великою Британією створена у 2014 році у відповідь на анексію Криму для швидкого реагування на загрози – до введення в дію статті 5 договору про НАТО."
2026-04-30,05:52,UP,https://www.pravda.com.ua/news/2026/04/30/8032449/,"Центральне командування США (CENTCOM) звернулося до Пентагону із запитом щодо перекидання на Близький Схід гіперзвукових ракет Dark Eagle для ураження цілей у глибині території Ірану. Джерело: Bloomberg з посиланням на особу, безпосередньо обізнану зі змістом запиту Деталі: За словами джерела агентства, CENTCOM прагне отримати систему більшої дальності для ураження пускових установок балістичних ракет, які Іран відвів за межі досяжності наявних у США ракет Precision Strike Missile (балістичних ракет малої дальності – ред.). У разі схвалення це стане першим випадком розгортання Сполученими Штатами гіперзвукової ракети, розробка якої значно відстає від графіка і яка ще не визнана повністю боєздатною, зазначає Bloomberg. Хоча з 9 квітня між США та Іраном діє режим припинення вогню, такий крок свідчить про підготовку Вашингтона до нових ударів, якщо президент Дональд Трамп ухвалить відповідне рішення. Ракета Dark Eagle, також відома як Long-Range Hypersonic Weapon (LRHW), за наявними даними, має дальність польоту понад 2700 кілометрів. Вона здатна розвивати швидкість, що у п'ять разів перевищує швидкість звуку, та маневрувати для уникнення перехоплення системами протиракетної оборони. Кожна така ракета виробництва Lockheed Martin коштує близько 15 мільйонів доларів. Наразі у розпорядженні США є не більше восьми одиниць цієї зброї, повідомив співрозмовник агенства. Загальна вартість однієї батареї таких комплексів оцінюється у 2,7 мільярда доларів. Наразі у війні проти Ірану США вже використали близько 1100 малопомітних крилатих ракет JASSM-ER."
2026-04-30,06:43,UP,https://www.pravda.com.ua/news/2026/04/30/8032450/,"Європейський Союз розробляє пакет тимчасових привілеїв для України, який передбачає ширший доступ до європейського ринку та інституцій без негайного повноправного членства. Джерело: Politico з посиланням на чотирьох дипломатів, обізнаних з ходом обговорень Деталі: Нова пропозиція з'явилася після того, як лідери ЄС відхилили ідею Єврокомісії про ""прискорене розширення"", яке передбачало вступ України до завершення ключових реформ. Натомість у Брюсселі розглядають модель ""прискореної поступової інтеграції"", що має дати Україні відчутні переваги вже зараз, поки вона продовжує виконувати необхідні для членства реформи. ""Країни-члени чітко дали зрозуміти, що членство в короткостроковій перспективі буде дуже важко уявити"", – сказав один із дипломатів. ""Але нам потрібна позитивна пропозиція щодо того, як ми можемо краще рухатися вперед разом до того часу"", – додав він. До розробки нової пропозиції активно залучені Німеччина та Франція, пише Politico. Минулого тижня канцлер Німеччини Фрідріх Мерц назвав прискорене членство України неможливим. Водночас він запропонував надати Києву право участі в засіданнях Європейської ради без права голосу та залучати до окремих форматів Європарламенту. Зі свого боку Литва пропонує надати Україні проміжний статус ""держави, що приєднується"". Раніше такий статус отримували країни, які вже підписали договір про вступ і чекали на його ратифікацію. У документі стверджується, що випадок України ""свідчить про те, що її європейський шлях досяг рівня сталості та спрямованості, який заслуговує на подібне визнання"". Водночас Україна наполягає на конкретній економічній допомозі. Посол України в ЄС Всеволод Ченцов заявив, що Київ прагне ""поетапного доступу до єдиного ринку ЄС, пов'язаного з прогресом у реформах, глибшої участі в програмах та інституціях ЄС, а також швидкого укладання Угоди про оцінку відповідності та прийняття промислових товарів (ACAA)"". Цей документ дозволить переміщувати українські промислові товари через європейський кордон без додаткових перевірок. Україна також просить залучити її підприємства до обговорення промислової стратегії Єврокомісії у таких галузях, як автомобілебудування, металургія та хімічна промисловість. За словами Ченцова, такі кроки принесуть ""негайні економічні вигоди"" та зміцнять довіру інвесторів, водночас зробивши шлях України до ЄС взаємовигідним ще до вступу. Європейські чиновники наголошують, що новий пакет привілеїв у жодному разі не замінить офіційний процес вступу. За словами комісара ЄС з питань розширення Марти Кос, сподівання на повноправне приєднання України у 2027 році залишаються ""нереальними"". Проте віцепрем'єр-міністр з питань європейської та євроатлантичної інтеграції України Тарас Качка повідомив, що очікує на відкриття офіційних переговорних кластерів ""найближчими тижнями"". Високопоставлений чиновник Європейської ради зазначив, що Україна зможе закрити переговорні кластери до кінця 2027 року лише за умови збереження нинішніх темпів реформ."
2026-04-30,06:55,UP,https://www.pravda.com.ua/news/2026/04/30/8032451/,"За минулу добу Сили оборони України вбили та поранили 1 470 російських окупантів, загальні втрати ворога у війні склали 1 330 290 осіб. Деталі: Загальні бойові втрати російських загарбників з 24.02.22 по 30.04.26 орієнтовно склали:"
